{
  "bundle_id": "bundle-show-001-2c3f8868",
  "show_id": "show-001",
  "runtime_target": "industrial_pc",
  "artifacts": [
    {
      "path": "compiled/show-001.luxshow.json",
      "kind": "canonical_show",
      "optional": false
    },
    {
      "path": "compiled/show-001.runtime-session.json",
      "kind": "runtime_session",
      "optional": false
    },
    {
      "path": "compiled/show-001.validation-report.json",
      "kind": "validation_report",
      "optional": false
    }
  ],
  "checksums": [
    {
      "path": "compiled/show-001.luxshow.json",
      "sha256": "2c3f8868fbcbd9b9f1dd06251f5995914ee11a42b76c253da3bdedadda3d0ad8"
    },
    {
      "path": "compiled/show-001.runtime-session.json",
      "sha256": "84922fa2299213940eece55c7fcb58d022a256fe73991d2ec9de6025637ea307"
    }
  ],
  "safety_profile": "default-field-profile",
  "requires_operator_ack": true
}